id dela*,naziv dela*,karakteristika kontrole*,linija id*,masina id*,kom za kontrolu n*,slika/crtez,aktivan,napomena,tip kontrole,vozilo katalog id,greska katalog id
5501-A,Nosac,Vizuelna kontrola vara i zazora,12,1,30,Nosac_SOP.jpg,DA,Karoserija linija,deo,,5501-A
5502-A,Osovina,Vizuelna kontrola povrsine i montaze,1,2,20,Osovina_SOP.jpg,DA,Preseraj linija,deo,,5502-A
5503-A,Poklopac,Kontrola zazora i brtvljenja,30,3,25,Poklopac_SOP.jpg,DA,Montaza finalna,deo,,5503-A
5504-B,Nosac motor,Vizuelna i funkcionalna kontrola,12,1,30,,DA,,deo,,GRUPA-NOSAC
5505-B,Konzola,Kontrola vara i dimenzija,12,2,20,,DA,,deo,,GRUPA-NOSAC
AUTO-001,Automobil-komplet,Finalna vizuelna kontrola celog vozila,48,1,5,Auto_final_SOP.jpg,DA,Koristiti za finalnu kontrolu,vozilo,FINAL-001,
AUTO-SUV,SUV komplet,Finalna kontrola SUV,48,1,5,,DA,Primer drugog modela,vozilo,SUV,
